Descrição,Horário de publicação,Link permanente,Tipo de publicação,Data,Impressões,Alcance,Compartilhamentos,Curtidas,Comentários,Salvamentos,Seguimentos,Reproduções
"Conquiste o sucesso e o crescimento contínuo das empresas através do Revenue Growth Management (RGM) na tomada de decisões de preços. Neste artigo do Aprix Journal, exploramos as ferramentas personalizadas para cada nível de maturidade na precificação, da consolidação de custos à otimização avançada com modelos matemáticos. 

Escolha a ferramenta certa para sua empresa e alinhe-a à sua estratégia de crescimento, transformando dados em decisões estratégicas. Qual delas ajudaria você em seu dia a dia?

Leia no Aprix Journal: bit.ly/ferramentas-de-pricing 

🔗 Link na bio.",01/11/2024 10:01,https://www.instagram.com/p/C1-E5cYuhyU/,Carrossel do Instagram,Vitalício,300,236,3,25,1,0,,
"Estamos com vagas abertas! 🚀
● Product Owner Intern
● Customer Success Intern
● Machine Learning Engineer Intern
● Junior Full Stack Developer
● People & Culture Intern

Procuramos pessoas para nos ajudar em nossa missão: desenvolver soluções de data science que auxiliem agentes de diferentes portes e segmentos a solucionar problemas na busca por maior eficiência. Mais especificamente, queremos acelerar o desenvolvimento ético de soluções de inteligência artificial.

Saiba mais sobre as vagas nos cards, ou acesse aprix.com.br/vagas para saber como é trabalhar na Aprix. O link está na bio 😉

Curtiu? Envie o seu currículo para careers@aprix.com.br",01/15/2024 12:01,https://www.instagram.com/p/C2Ik3H4us7G/,Carrossel do Instagram,Vitalício,925,769,45,70,1,13,5,
"Não é novidade que as equipes podem melhorar a sua performance quando trabalham em conjunto com a Inteligência Artificial. Mas e quando usamos a IA para tornar processos inteiros mais eficientes?

Segundo o professor do Instituto de Pesquisas Tecnológicas Adriano Galindo Leal, o potencial é gigantesco. “A produtividade pode ser multiplicada por 10 com um processo que harmoniza a atuação de humanos e dos diversos agentes de IA especialista”, diz o professor.

Um dos processos nas indústrias que pode se tornar mais eficiente com a aplicação da IA é a precificação. Leia a matéria do Aprix Journal em https://bit.ly/3SiOcdI, ou pelo link na bio.",01/16/2024 11:01,https://www.instagram.com/p/C2LEtEFuW9w/,Imagem do Instagram,Vitalício,230,202,0,14,0,0,,
"No mês passado, a equipe de pricing da Ipiranga nos recebeu para aprender com o curso especializado em Pricing e Revenue Management da Aprix, que trata do uso de ciência de dados e inteligência artificial para otimizar as decisões de preço. 

Ao longo de dois dias, o CEO da Aprix, Guilherme Zuanazzi, esteve na sede da Ipiranga para compartilhar conhecimento e auxiliar a empresa otimizar os resultados do pricing, do início ao fim do processo. Foram oito horas de curso, compartilhando casos reais em diversos segmentos, em torno dos seguintes tópicos:

→ Conceitos básicos de precificação
→ Estratégias de precificação
→ Elasticidade, Elasticidade Cruzada, Point-elasticity e Elasticidade Variável
→ Market-based pricing e Teoria dos Jogos
→ Ciência de dados e IA para modelagem de demanda em função de preços: Modelos Lineares e Modelos Não-Lineares

Agradecemos à equipe da Ipiranga pela confiança e pelas trocas enriquecedoras, em especial, ao Bruno Moritz, à Carolina Gomes e ao Axel Turque.

Se você também tem interesse em maximizar seus resultados a partir de estratégias de pricing baseadas em ciência de dados, conheça o treinamento completo da Aprix para empresas. Link na bio.",01/17/2024 11:01,https://www.instagram.com/p/C2NrYVVudD1/,Carrossel do Instagram,Vitalício,287,227,0,14,0,1,,
"O primeiro passo para estabelecer uma jornada de crescimento com Revenue Management é consolidar um processo robusto de precificação. Mas o que é o “básico” no pricing?

Durante o Aprix Connect, Daniel Bannwart Rago comentou sobre isso no painel “O poder do pricing sobre o EBITDA”. Neste texto do Aprix Journal, compartilhamos alguns pontos essenciais na jornada de sucesso do pricing. 

O que você acrescentaria a essa lista?

Leia no Aprix Journal. Acesse https://bit.ly/3U6s6w9 ou o link na bio.",01/18/2024 11:01,https://www.instagram.com/p/C2QO3dcue9w/,Imagem do Instagram,Vitalício,169,150,0,6,0,0,,
"LANÇAMENTO: Aprix Academy 🎓 

Tudo sobre pricing e RGM em um só lugar

Na Aprix, acreditamos que a eficiência deve estar no centro das nossas soluções. Compartilhar conhecimento e ser ponto de encontro para profissionais especialistas em pricing e RGM também é uma forma de atingir este objetivo.

Pensando nisso, criamos uma página que centraliza os melhores materiais educativos sobre pricing para você alcançar resultados excepcionais.

Além de oferecer ebooks, webinars, jornadas de conhecimento personalizadas e outros conteúdos produzidos pela Aprix, selecionamos uma curadoria de materiais de outras empresas cujo trabalho é voltado para desenvolver o Revenue Growth Management nas companhias.

Conheça a Aprix Academy e acelere o desenvolvimento de sua carreira!

Acesse aprix.com.br/academy/ ou link na bio.",01/24/2024 11:01,https://www.instagram.com/p/C2fpPslOyvf/,Carrossel do Instagram,Vitalício,282,233,4,29,2,2,,
"Foi lançada a Aprix Academy, plataforma voltada para profissionais de pricing e RGM para centralizar conhecimento e ser ponto de referência sobre os melhores materiais educativos de diversas empresas especialistas em Revenue Growth Management.

A página conta com quatro Jornadas de Pricing, trilhas de conteúdos específicas para impulsionar profissionais em diferentes estágios da carreira.

Conheça a Aprix Academy e acelere seu desenvolvimento. 

Acesse aprix.com.br/academy, ou o link na bio.",01/25/2024 11:01,https://www.instagram.com/p/C2iP9xrOXe-/,Imagem do Instagram,Vitalício,216,199,0,16,0,0,,
"Em outubro de 2023 realizamos a 1ª edição do Aprix Connect — e foi um sucesso! 

Confirmamos nossa hipótese sobre uma das necessidades do mercado de pricing no Brasil, que já tem ótimos profissionais e um potencial imenso de crescimento, mas precisava de um ponto de encontro para trocar conhecimento e experiências. 

Mais do que isso, ficamos muito felizes em construir em conjunto um espaço para fortalecer a comunidade e conectar os profissionais de pricing do Brasil! 

Pensando em tornar esse evento cada vez melhor, já estamos planejando as novidades para a próxima edição. Acompanhe nossas redes para ficar por dentro de todas as atualizações. 

A data do Aprix Connect 24 será divulgada em breve! O que não pode faltar nesta edição?",01/29/2024 11:01,https://www.instagram.com/reel/C2slpQKuqoA/,Reel do Instagram,Vitalício,282,261,0,26,1,0,,463
"As soluções em nuvem, são uma tendência na área da tecnologia, especialmente devido à eficiência operacional e segurança de dados. Elas vêm assumindo protagonismo em processos que envolvem desde a contratação de fornecedores até a gestão da base de clientes através de CRM.

É por isso que as soluções da Aprix, na sua maioria, operam na nuvem! ☁️

Para entender as particularidades do modelo cloud e do seu predecessor, o on-premises, leia a matéria do Aprix Journal. Acesse: https://bit.ly/47X2kL, ou o link na bio.",01/30/2024 11:01,https://www.instagram.com/p/C2vExsAOmbb/,Imagem do Instagram,Vitalício,232,212,0,9,0,0,,
"A Aprix está no @braziljournal 📰
O jornal digital mais lido por CEOs, CFOs, empreendedores e investidores do Brasil.

Desde passagens aéreas até as corridas da Uber, o mercado dá cada vez mais indícios de que a granularização das decisões de preço é uma tendência para a maximização de receita. Segundo um estudo da McKinsey, estratégias de precificação podem aumentar os lucros em até 50%.

No Brazil Journal, contamos como a Aprix vem aplicando essas premissas à realidade brasileira há mais de cinco anos. 

Leia em: https://bit.ly/Aprix-BrazilJournal ou no link na bio!",01/31/2024 08:01,https://www.instagram.com/p/C2xZuYiO83p/,Carrossel do Instagram,Vitalício,260,216,0,20,4,0,,
"Palavra do fundador | Guilherme Baggio Zuanazzi, CEO & Founder da Aprix, compartilha reflexões sobre o ano que passou e projeções para o futuro. Zuanazzi destaca a evolução nas soluções da empresa para grandes players, bem como a expectativa de crescimento para 2024.

Leia no Aprix Journal. Acesse: https://bit.ly/3HK08Pm, ou o link na bio.",02/01/2024 09:02,https://www.instagram.com/p/C20FGIoOwro/,Imagem do Instagram,Vitalício,380,353,1,24,0,0,,
"Depois de reconhecer a necessidade de implementar um software para elevar o nível de maturidade do pricing na sua empresa, é preciso decidir entre contratar uma solução SaaS, com expertise em precificação, ou de desenvolvê-lo internamente pela equipe. 

Saiba quais fatores devem ser considerados nessa decisão e veja os prós e contras das duas opções nesta matéria do Aprix Journal.

Leia a matéria completa em: https://bit.ly/3SO7iIQ ou link na bio.",02/06/2024 10:02,https://www.instagram.com/p/C3BErCxuND8/,Imagem do Instagram,Vitalício,352,315,0,9,0,1,,
"Kickoff de Projeto com a equipe da @arcor! 🚀 

Tivemos o prazer de iniciar oficialmente nossa parceria com a Arcor, em uma reunião que envolveu as áreas de planejamento, incluindo as equipes de, marketing, comercial e TI da empresa. O objetivo do projeto é apontar oportunidades de maximização de share e rentabilidade através das decisões de pricing.

Agradecemos especialmente ao Juan Santiago Peralta, CFO da empresa, que desempenhou um papel crucial e demonstrou um comprometimento excepcional para garantir o sucesso do projeto. Uma experiência enriquecedora que nos deixa ansiosos para explorar mais a fundo as oportunidades que surgiram. 

Agradecemos também Federico Meschini, João Crédito, Thiago Vieira, André Lemos e Maria Flávia Merola, além das demais equipes que estão fazendo esse projeto acontecer.",02/07/2024 11:02,https://www.instagram.com/p/C3DvPtNOWXf/,Imagem do Instagram,Vitalício,960,869,21,120,4,0,1,
"Os preços do cacau continuam em ascensão, atingindo o dobro do valor registrado no último ano, o que gera preocupações para as empresas do setor de chocolates. O prognóstico não é dos melhores: desde janeiro do ano passado que os preços de referência do cacau em Nova Iorque já dispararam 129% e 35% desde o início deste ano e podem chegar aos dez mil dólares daqui a seis anos.

Diante desse cenário, as empresas encontram desafios para precificar seus produtos perto de uma época de alta nas vendas.

Leia no Aprix Journal. Acesse: https://bit.ly/42HWhfx, ou o link na bio.

Marque alguém aqui que pode se interessar por este conteúdo!",02/15/2024 12:02,https://www.instagram.com/p/C3Ybq7EOLfW/,Imagem do Instagram,Vitalício,290,261,0,18,0,0,,
"Os CFOs que se mantêm ágeis e proativos estarão melhor posicionados para garantir o sucesso financeiro das suas organizações. Este guia busca ser um farol, guiando os CFOs através das complexidades e oportunidades que se apresentam no horizonte financeiro do ano atual. A especialista de inflação na Warren, Andrea Angelo, pontua as principais projeções econômicas para este ano.

Leia em: bit.ly/guiaCFOs, ou acesse o link na bio.",02/20/2024 11:02,https://www.instagram.com/p/C3lPSycu9Vi/,Imagem do Instagram,Vitalício,135,124,0,10,0,0,,
"Você já conhece as Jornadas de Pricing da Aprix?

Sempre há algo novo para aprender e aprimorar em sua carreira profissional. No entanto, nem sempre está claro qual caminho seguir.

As Jornadas de Pricing da Aprix são trilhas de conteúdo que mostram o que você deve saber para evoluir na carreira e melhorar o potencial da precificação em sua empresa.

Inscreva-se agora e trilhe o caminho para o sucesso com as Jornadas de Pricing da Aprix. Acesse: https://bit.ly/JornadasPricing. Link na bio.",02/21/2024 11:02,https://www.instagram.com/p/C3nvP0Du45V/,Carrossel do Instagram,Vitalício,174,147,2,23,0,0,1,
"A estratégia de gestão de receita visa analisar e controlar os preços e a disponibilidade dos seus produtos ou serviços para aumentar a lucratividade. Com a aplicação do Revenue Management, por meio do pricing, é possível melhorar a rentabilidade, posicionar-se competitivamente no mercado, gerenciar recursos com mais eficiência e satisfazer as necessidades dos clientes.

Saiba como aplicá-las e impulsionar o seu negócio a longo prazo nesta matéria do Aprix Journal. Leia em: https://bit.ly/3UJbTLP, ou acesse o link da bio.",02/22/2024 12:02,https://www.instagram.com/p/C3qdOkGOD3j/,Imagem do Instagram,Vitalício,131,122,0,6,0,0,,
"Você sabia que cerca de 64% dos profissionais acreditam que tarefas repetitivas, que poderiam ser automatizadas, reduzem sua produtividade?

O relatório “Getting Smarter by the Day: How AI is Elevating the Performance of Global Companies”, realizado pela Tata Consultancy Services e divulgado em fevereiro de 2020, analisou o impacto que os investimentos em IA geram nas operações.

A maioria dessas empresas diz que obteve melhorias de receita e de custo nas áreas em que a IA foi implementada.
No Aprix Journal, reunimos três formas de melhorar a performance das equipes com soluções de inteligência artificial.

Leia no Aprix Journal. Acesse: https://bit.ly/49txezb, ou o link da bio.

De que formas você usa IA em seu trabalho?",02/27/2024 11:02,https://www.instagram.com/p/C33Pcb4OagF/,Imagem do Instagram,Vitalício,174,158,0,15,0,0,,
"Apesar de ser um tópico de popularidade crescente, a inteligência artificial ainda não é amplamente compreendida no mercado. Na precificação, os algoritmos de machine learning podem protagonizar ganhos significativos em eficiência e qualidade na tomada de decisões. Mas como isso acontece? No post de hoje, o Aprix Journal explica como fatores macroeconômicos influenciam algoritmos de precificação.

Leia no Aprix Journal. Acesse: https://bit.ly/42Ytm72, ou o link na bio",02/29/2024 12:02,https://www.instagram.com/p/C38bOCWOzzT/,Imagem do Instagram,Vitalício,144,134,0,10,0,0,,
"Todo estrategista de pricing precisa enxergar além do preço.

Explore o universo do RGM para além do pricing com a nossa newsletter quinzenal, Além do Preço! ✉️

Descubra conteúdos da curadoria exclusiva da Aprix, com atualidades que moldam o cenário de negócios, tecnologia e inovação, mergulhando nas nuances e tendências dessas temáticas. 

Junte-se a nós nessa jornada informativa e amplie sua visão sobre o mundo do RGM. Acesse: bit.ly/AlémdoPreço, ou o link na bio.",03/05/2024 03:03,https://www.instagram.com/p/C4IajDNuUwj/,Carrossel do Instagram,Vitalício,163,126,0,19,0,0,,
"Descubra como a Quarta Revolução Industrial está impulsionando o desenvolvimento ético de soluções para otimizar os processos humanos. Estamos na era da eficiência, com tecnologias que mudam a forma como executamos as tarefas. 

A inteligência artificial, a bioengenharia, a internet das coisas e as energias sustentáveis estão contribuindo para revolucionar a maneira como vivemos e trabalhamos.

De que maneira você vê isso acontecer em seu trabalho?

Leia no Aprix Journal. Acesse: bit.ly/3KhM8Po, ou o link na bio.",03/05/2024 11:03,https://www.instagram.com/p/C4JPz66uVtp/,Imagem do Instagram,Vitalício,148,136,0,9,0,0,,
"O CPO da Aprix, @fred.lmc, participou do podcast Radar de Inovação, de @gzhdigital.

As empresas brasileiras apresentam inúmeras possibilidades de otimização nos processos de precificação. De eficiência operacional a otimização de decisões com IA, empresas na Europa e nos EUA já oferecem soluções para o mercado internacional. E é isso que a Aprix vem fazendo no Brasil há seis anos.

No programa, Maciel compartilhou um pouco da trajetória da Aprix e dos resultados que a empresa vem conquistando com o produto.

Escute no Spotify ou assista no Youtube. Links na bio.",03/08/2024 05:03,https://www.instagram.com/p/C4QV3ggOivg/,Carrossel do Instagram,Vitalício,227,186,5,28,3,0,,
"O lançamento de produtos é uma tarefa complexa que envolve muitos fatores, um deles é a análise da elasticidade de preço. Mas como calcular a elasticidade de produtos recém-lançados, especialmente quando não há dados históricos de vendas disponíveis?

Nesta matéria do Aprix Journal, entenda como funciona o cálculo de elasticidade pelo sistema de pricing da Aprix.

Leia em: https://bit.ly/3IwXbCe. Link na bio.",03/12/2024 12:03,https://www.instagram.com/p/C4bTi7BOjRV/,Imagem do Instagram,Vitalício,192,178,0,8,0,0,,
"Estamos animados em anunciar nosso projeto com a @melittabrasil! ☕

Na terça e quarta-feira desta semana fomos recebidos na sede da empresa em São Paulo para dar início à nossa parceria. O foco do projeto é em ganho de eficiência operacional no processo de precificação, tendo como consequência o aumento da lucratividade da companhia.

Agradecemos ao time de pricing e às equipes de TI, de controladoria e comercial pela confiança no projeto. Além disso, contamos também com a expertise da consultora Ana Efigênia Souza Barros para potencializar o impacto do nosso trabalho. Estamos ansiosos por tudo o que vamos construir em conjunto! 🚀",03/14/2024 07:03,https://www.instagram.com/p/C4f7Na8uJvo/,Imagem do Instagram,Vitalício,698,635,4,85,5,0,5,
"A Aprix vai participar pela terceira vez do South Summit Brazil.

Desde a primeira edição do evento, em 2022, colhemos os frutos da premiação de Melhor Time da competição de startups, devido à visibilidade do reconhecimento. O evento foi tema de uma matéria da Rede Record, que foi ao ar no último sábado. 

Assista à matéria completa: bit.ly/AprixSouthSummit2024 ou clique no link da bio.",03/18/2024 11:03,https://www.instagram.com/p/C4qmHBhuBdc/,Carrossel do Instagram,Vitalício,321,254,8,52,2,0,,
"Primeiro dia de @southsummitbrazil 2024! 💡

Esta é a terceira participação da Aprix no evento. Na primeira edição, em 2022, vencemos o prêmio de Melhor Time da competição de startups, uma conquista muito importante em nossa trajetória.

Este é um evento que reúne pessoas interessadas nas maiores tendências em tecnologia, criatividade e futuro do trabalho de todo o mundo. É um encontro do ecossistema de startups que coloca em contato quem está empreendendo, inovando ou investido. E a Aprix está aqui, pronta para receber você em nosso stand.

Se estiver por perto, venha nos visitar e conhecer nossas soluções para precificação. Os módulos do sistema Aprix têm o potencial de transformar seu negócio, impulsionando a eficiência dos processos e maximizando os resultados.

Esperamos você!",03/20/2024 07:03,https://www.instagram.com/p/C4vUxMXOOMK/,Imagem do Instagram,Vitalício,522,480,10,70,1,0,,
"Na Aprix, além de agir todos os dias para garantir a equidade e um ambiente propício para o desenvolvimento de todas as pessoas, reconhecemos a importância de relembrar e celebrar as conquistas para não serem apagadas.

Em homenagem ao Dia Internacional das Mulheres, tivemos uma sessão especial do Cine Aprix, com a exibição do filme ""Estrelas Além do Tempo"" (2016). A obra conta a história de três mulheres negras que foram essenciais no trabalho da NASA durante a corrida espacial: Katherine Johnson, Dorothy Vaughn e Mary Jackson. 🚀👨🏿‍🚀

A escolha do filme se deve à sua relação com o Manifesto Aprix: apostamos no método científico e na valorização da diversidade para impulsionar a inovação e alcançar resultados excepcionais. E é isso que as engenheiras aeroespaciais Katherine, Dorothy e Mary demonstram no decorrer da obra. Apesar dos obstáculos impostos a elas, as três tiveram carreiras fundamentais para o desenvolvimento científico. 

Acreditamos que, em um ambiente de trabalho que funcione como propulsor de talentos, em vez de impor obstáculos, as pessoas podem atingir ainda mais seu potencial. Esperamos (e trabalhamos para) ver cada vez mais engenheiras, matemáticas e cientistas conquistando as posições que almejam.

Quer fazer parte do nosso time? Acesse aprix.com.br/vagas para saber como é trabalhar na Aprix. Link na bio.",03/21/2024 05:03,https://www.instagram.com/p/C4xvHJduPJi/,Carrossel do Instagram,Vitalício,227,178,2,36,0,0,,
"Iniciamos mais um projeto com a @dexco.oficial! 

A Dexco contratou no ano passado o treinamento em pricing da Aprix, feito para equipes que querem evoluir e agregar inteligência a seu processo de precificação. A partir de então, compreendeu-se a oportunidade de ganhar eficiência no processo com o software da Aprix. 

O objetivo deste projeto é construir um processo de precificação robusto e otimizado, gerando ganho de tempo para as equipes de pricing, comercial, performance comercial, controladoria, produto, TI e cadastro.

Quer saber como a Aprix pode ajudar a sua empresa a elevar a maturidade do pricing? Acesse o link na bio e conheça nossas soluções.",03/25/2024 11:03,https://www.instagram.com/p/C48q6oyOsNZ/,Imagem do Instagram,Vitalício,133,125,0,16,0,0,,
"A especialista em pricing Ana Efigênia Souza Barros escreve bimensalmente para o Aprix Journal. Neste mês, a consultora fala sobre as relações entre o pricing e outras áreas da companhia e sugere como cultivá-las da melhor forma.

Ana Efigênia é uma profissional especializada em Pricing e Revenue Management com mais de 20 anos de experiência liderando áreas e projetos em grandes empresas nos setores B2C, B2B, serviços e commodities. Atualmente, atua como consultora pela Plano A em projetos de diferentes segmentos de mercado.

Leia no Aprix Journal. Acesse bit.ly/MultidisciplinaridadePricing, ou o link na bio.

➡️ Quer saber mais sobre a relação com alguma área específica? Comente qual delas deve ser aprofundada no Aprix Journal.",03/26/2024 12:03,https://www.instagram.com/p/C4_RG2uujoa/,Imagem do Instagram,Vitalício,128,119,0,12,0,0,,
"Celebrando 6 anos de história! 🎉🚀

A jornada da Aprix continua repleta de desafios, conquistas e inovação. Neste novo capítulo, renovamos nosso compromisso de oferecer uma plataforma de precificação versátil, impulsionada pela inteligência artificial, e soluções focadas em elevar o nível de maturidade em pricing de nossos clientes. 

Continuamos cultivando uma cultura forte, valorizando o aprendizado contínuo e encarando cada desafio como uma oportunidade de crescimento. 

Agradecemos a todos os talentos e clientes que fazem parte dessa jornada.",03/27/2024 09:03,https://www.instagram.com/p/C5BmHZcOd1g/,Carrossel do Instagram,Vitalício,262,207,2,47,4,0,,
"Anunciamos os primeiros parceiros homologados da Aprix! 🤝

É uma honra contar com nomes de peso do mercado para fortalecer as conexões entre a comunidade de profissionais de pricing no Brasil e a Aprix, e, assim, ajudar a entregar cada vez mais eficiência para nossos clientes!

Ana Efigênia Souza Barros é consultora com mais do 20 anos de experiência atuando no gerenciamento de RGM em grandes companhias, como Mondelēz e Vigor.

Jose Altschuller foi Diretor de Supply Chain da Walmart e especialista nas relações indústria e varejo, com uma visão sistêmica da cadeia de suprimentos.

Ambos estiveram conosco por +20 horas de treinamento sobre os desafios de nossos clientes e sobre como podemos contribuir para incrementar resultados através das soluções Aprix! 🚀

Caso você tenha interesse em saber mais sobre o programa de homologação de parceiros Aprix, fique à vontade para entrar em contato.",04/01/2024 13:04,https://www.instagram.com/p/C5O1BaZuXS1/,Carrossel do Instagram,Vitalício,140,114,0,17,0,0,,
"A especialista em pricing Ana Efigênia Souza Barros estreia como colunista mensal do Aprix Journal. Em seu primeiro texto, sugere habilidades nas quais as pessoas da área podem investir para se desenvolver.

Ana Efigênia é uma profissional especializada em Pricing e Revenue Management com mais de 20 anos de experiência liderando áreas e projetos em grandes empresas nos setores B2C, B2B, serviços e commodities. Atualmente, atua como consultora pela Plano A em projetos de diferentes segmentos de mercado.

Em quais habilidades você vai investir neste ano?

Leia no Aprix Journal. Acesse bit.ly/capabilities-pricing, ou o link na bio.",01/04/2024 04:01,https://www.instagram.com/p/C1rbSWmOq8p/,Imagem do Instagram,Vitalício,179,163,0,15,0,0,,
"Já mostramos no Aprix Journal que a aplicação da Inteligência Artificial no processo de pricing otimiza recursos, visto que reduz o erro humano, poupa esforços operacionais e diminui o tempo de execução.

Nesse texto, mostramos quatro etapas que podem ser otimizadas com IA, criando um processo à prova de erros.

Saiba como a Inteligência Artificial pode ajudar equipes de pricing a otimizar o tempo e os resultados de tarefas como cálculo de custos variáveis, alinhamento às políticas comerciais, verificação da margem de contribuição e projeção do markup.

Leia em: https://bit.ly/3HLKUsm, ou acesse o link na bio.",01/10/2024 08:01,https://www.instagram.com/p/C17Tt3WOftE/,Imagem do Instagram,Vitalício,147,135,0,8,0,0,,
