Descrição,Horário de publicação,Link permanente,Tipo de publicação,Data,Impressões,Alcance,Compartilhamentos,Curtidas,Comentários,Salvamentos,Seguimentos,Reproduções
"No painel “O poder do pricing sobre o EBITDA da sua companhia”, especialistas em pricing discutirão estratégias, ferramentas e práticas de empresas que têm os preços como um dos pilares na geração de resultados.

Quem media a discussão é George Papageorgiou, sócio na DOC, consultoria especializada em pricing e revenue management. George é um executivo sênior com experiência na liderança de equipes comerciais, trade marketing, key account management e excelência comercial em empresas FMCG e Farma.

🎫 Os ingressos para o evento estão esgotados, mas você pode entrar na fila de espera, acessando: http://bit.ly/AprixConnect2023, ou no link da bio.",10/04/2023 13:10,https://www.instagram.com/p/Cx_VXkSu2Ch/,Imagem do Instagram,Vitalício,221,190,0,11,0,0,,
"Jose Inacio Neto é diretor de Revenue Management na L'Oréal, com experiência em planejamento estratégico de vendas e Revenue Management em grandes empresas. Atuou em diversas indústrias, como BRF, Johnson & Johnson e GSK. José será um dos painelistas do Aprix Connect, participando do painel “Como criar uma cultura de RGM na sua companhia?”.

A governança organizacional será discutida como elemento essencial para a cultura de RGM, com foco na necessidade de alinhar metas e decisões entre os departamentos. Também será abordada a relação entre os setores de pricing e o departamento comercial.

Os ingressos para o evento estão esgotados, mas você pode entrar na fila de espera, acessando o link: http://bit.ly/AprixConnect2023",10/06/2023 11:10,https://www.instagram.com/p/CyEV5fCOnZR/,Imagem do Instagram,Vitalício,270,237,0,10,0,0,,
"A política monetária e o panorama macroeconômico impactam diretamente o pricing das empresas CPG, influenciando custos, margens de lucro e demanda do consumidor. Uma compreensão sólida dessa relação é crucial para tomar decisões de pricing eficazes no setor.

Na palestra “Perspectivas econômicas no Brasil e impactos nos preços”, a especialista em inflação e estratégia da Warren Andréa Angelo aprofundará como as decisões de políticas monetárias vêm afetando a economia, incluindo seu impacto na inflação, no investimento e no consumo. 

🎫 Ingressos esgotados! Entre na fila de espera para o Aprix Connect acessando: http://bit.ly/AprixConnect2023, ou no link da bio.",10/09/2023 10:10,https://www.instagram.com/p/CyL4cOhuQ-U/,Imagem do Instagram,Vitalício,239,213,0,14,0,0,,
"Falta uma semana para o Aprix Connect 2023!

Estamos nos preparando para receber os participantes do Aprix Connect da melhor maneira possível, em um ambiente confortável e acessível a todos.

Será uma tarde durante a qual os maiores nomes do pricing terão acesso a conteúdos muito ricos, com cases e boas práticas em algumas das maiores empresas do país.

Além disso, haverá vários momentos de networking, para fomentar e fortalecer a comunidade de pricing do Brasil.
Confira a programação completa acima:

🎫 Os ingressos para o evento estão esgotados, mas você ainda pode entrar na fila de espera, acessando o link: https://lnkd.in/daF3YeHg",10/10/2023 15:10,https://www.instagram.com/p/CyPAGAyueHE/,Carrossel do Instagram,Vitalício,306,234,2,22,0,0,,
"O uso da IA para tomar decisões de preços se tornará cada vez mais uma necessidade para os times e as lideranças que desejam performar em mercados competitivos. Quando se trata de Revenue Growth Management, a tecnologia é essencial para resolver problemas complexos de precificação com alto volume de dados.

No Aprix Connect, quem falará sobre o tema é o CEO da Aprix, Guilherme Zuanazzi. Na palestra “IA como aliada na precificação”, o especialista compartilhará sobre os desafios e sucessos da jornada de adoção da tecnologia para evoluir a maturidade do pricing em grandes cias. 

Os ingressos para o evento estão esgotados, mas você ainda pode entrar na fila de espera, acessando o link: http://bit.ly/AprixConnect2023",10/11/2023 11:10,https://www.instagram.com/p/CyRJLVfu4cc/,Imagem do Instagram,Vitalício,376,322,0,19,0,0,,
"Ficamos muito felizes com nossa participação no @rioinnovationweek 🚀

Ao longo de três dias, cerca de 130 mil pessoas compareceram ao evento para mergulhar em discussões sobre tecnologia e inovação, com aproximadamente 1500 palestrantes.

Agradecemos ao público que prestigiou a sessão técnica sobre Indústria, onde Bernardo Queiroz apresentou o case de um cliente Aprix, e o painel “Alavancando resultados através do pricing com Inteligência Artificial”, formado por Gabriel Vargas Correa, da Aprix, Isabela Ribeiro e Danilo Sad, da Vibra Energia. Ficamos muito satisfeitos com mais essa parceria com a Vibra.

A Aprix acredita que a difusão do conhecimento é essencial para gerar inovação, por isso, apreciamos a oportunidade de participar deste evento compartilhando algumas das nossas experiências.",10/13/2023 11:10,https://www.instagram.com/p/CyWV-4eOW4n/,Imagem do Instagram,Vitalício,503,435,1,31,2,0,,1
"O Aprix Connect é hoje! 🚀

Com cinco anos do mercado de tecnologias para pricing no Brasil, percebemos que, embora o gerenciamento de receita seja assunto importante e com relevância crescente no cenário nacional, ainda carece de ambientes para troca entre profissionais.

Cientes desta lacuna, decidimos criar o Aprix Connect para ser um espaço que reúna os maiores profissionais de pricing do Brasil. O objetivo é compartilhar experiências, disseminar boas práticas e, é claro, fortalecer o ecossistema das disciplinas de Pricing e Revenue Growth Management no país.

Estamos muito empolgados com a realização deste evento! Não deixe de nos acompanhar em nossas redes sociais para não perder nenhum detalhe! 😉",10/17/2023 08:10,https://www.instagram.com/p/CygRPp7OXGu/,Imagem do Instagram,Vitalício,539,460,4,34,3,0,,
"A primeira edição do Aprix Connect foi um sucesso! 🚀

Decidimos criar o Aprix Connect para ser um espaço que reúna alguns dos principais profissionais de pricing e RGM do Brasil: conseguimos! 

Estamos extremamente realizados com as trocas genuínas que aconteceram ontem. Os feedbacks positivos sobre o evento reforçam a ideia de que é possível construir uma comunidade compartilhando conhecimento e boas práticas em um espaço diverso e aberto pro debate!

Nossos mais sinceros agradecimentos aos speakers e a todos os participantes.

Até ano que vem! 💙",10/18/2023 09:10,https://www.instagram.com/p/CyjCR70uAXb/,Imagem do Instagram,Vitalício,950,734,4,94,11,0,,
"A Aprix é uma das @100openstartups 2023! 🏆

Ficamos classificados no top 5 da categoria Artificial Intelligence. O ""Top 100 Open Startups"" destaca as empresas mais inovadoras e promissoras do ecossistema nacional de startups. Receber este prêmio em um ano no qual os avanços em IA tiveram tanto destaque e aplicação em soluções cotidianas apenas reforça a legitimidade de nossa missão: gerar eficiência para nossos clientes através de IA.

Agradecemos a Open Startups pelo prêmio, aos clientes, que confiam em nossa solução, e a toda a equipe da Aprix por tornar possíveis conquistas como esta.",10/19/2023 12:10,https://www.instagram.com/p/Cyl7BX-OKaj/,Imagem do Instagram,Vitalício,1263,967,20,172,11,1,,6
"Neste mês, realizamos três visitas à Ipiranga para reforçar nosso vínculo, avaliar oportunidades e alinhar nossa visão para o futuro da nossa parceria, que já dura três anos.

Agradecemos à Ipiranga pela confiança contínua. Estamos animados para o que o futuro nos reserva.",10/20/2023 09:10,https://www.instagram.com/p/CyoKiWguKDo/,Imagem do Instagram,Vitalício,627,522,2,44,0,0,,
"A Farma Conde é comprometida com a inovação e busca estar alinhada às melhores práticas de mercado em pricing. Estamos muito felizes com a parceria e empolgados com o futuro da nossa colaboração.

Na última semana, o CRO da Aprix, Bernardo Queiroz, compareceu ao We Conde Xperience, um evento que celebrou os 30 anos de sucesso da rede no varejo farmacêutico.

Também visitamos a Farma Conde e tivemos a honra de conhecer Manoel Conde, diretor da empresa. Apresentamos o projeto e os resultados obtidos até o momento, reforçando a relevância do pricing para a companhia, bem como os próximos passos.

Parabéns a toda a equipe da Farma Conde pelos 30 anos da empresa!
Agradecemos a Marcia Jaqueline Santana, Izabel Ramos, Bárbara Gouveia, Felipe Azevedo e Gilson Queiroz pelo convite e pela recepção.",10/27/2023 06:10,https://www.instagram.com/p/Cy55XJRux37/,Imagem do Instagram,Vitalício,579,530,3,35,3,0,,
"Fomentar e fortalecer a comunidade de pricing no Brasil: esse foi o nosso objetivo ao criar o Aprix Connect. 

Construímos um ambiente para compartilhar conhecimento, trocar experiências e promover conexões entre alguns dos maiores profissionais de pricing do país. 

O Aprix Connect reuniu mais de 120 pessoas interessadas em aprender mais sobre o universo do Revenue Growth Management e as últimas tendências em pricing no Brasil. Apesar de ser uma área emergente em muitas empresas brasileiras, 43% dos participantes estão em cargos com os termos ""Pricing"" ou ""RGM"" e correlatos no título. Esse número é muito significativo, considerando a escassez de ambientes propícios para a reunião de profissionais especializados e para a discussão da disciplina. 

Além disso, os demais 57% foram ao evento pois conhecem a relevância da disciplina, ou estão em empresas que reconhecem sua importância. Estas pessoas estão aprimorando suas carreiras e adquiriram grande potencial de promover uma cultura de pricing e RGM em suas companhias. Para a Aprix, isso significa um passo muito importante na nossa missão de ajudar empresas de diferentes setores a ganhar eficiência! 

Agradecemos a todos os palestrantes, painelistas e participantes por contribuírem para a riqueza das discussões. 

Nos orgulhamos muito do que construímos na primeira edição do Aprix Connect e nos vemos em 2024!",10/30/2023 13:10,https://www.instagram.com/p/CzCSCglOm-m/,Carrossel do Instagram,Vitalício,297,247,0,27,0,0,,
"No dia 17 de outubro, o STATE Innovation Center, em São Paulo, foi palco do Aprix Connect, que reuniu mais de 120 profissionais que trabalham com pricing e Revenue Growth Management (RGM) no Brasil. Com doze palestrantes de empresas reconhecidas, o evento foi projetado para discutir as tendências no mercado, promover a troca de experiências, compartilhar boas práticas e estimular o networking, com o objetivo de fortalecer e integrar a comunidade de pricing no Brasil.

Nesta matéria do Aprix Journal, saiba mais sobre a primeira edição do Aprix Connect e confira um resumo das palestras e painéis. Acesse: bit.ly/3tT7nAV, ou o link na bio.

Qual insight mais chamou sua atenção?",11/01/2023 05:11,https://www.instagram.com/p/CzGpvsIujYa/,Imagem do Instagram,Vitalício,224,202,0,22,1,0,,
"O Revenue Management, também conhecido como Gestão de Receita, surgiu nos anos 80 nos Estados Unidos, inicialmente nas companhias aéreas, como uma resposta à crescente concorrência. Ao longo dos anos, expandiu-se para setores como hotelaria e aluguel de automóveis, visando maximizar lucros através de estratégias de precificação, gestão de oferta e previsão de demanda.

Na coluna de Pedro Piccoli Soares, o especialista explica o poder do Revenue Management para maximizar lucros e competitividade em diversos setores.

Leia em bit.ly/3MqjADu, ou no link da bio.",11/03/2023 09:11,https://www.instagram.com/p/CzMMYwSu4qE/,Imagem do Instagram,Vitalício,151,136,0,6,0,0,,
"A primeira etapa do processo de pricing consiste na consolidação de dados de várias fontes, como as áreas de marketing, trade e vendas, em uma planilha unificada.

O processo de consolidação de dados é normalmente realizado manualmente pelo time de pricing, o que o torna suscetível a erros e consome muito tempo da equipe. Em um cenário de inflação alta e dinamismo no mercado, esse tempo pode ser crucial para determinar o posicionamento de preços.

Saiba como otimizar esse processo no Aprix Journal. Leia em bit.ly/3QN3Z2z, ou no link da bio.",11/09/2023 05:11,https://www.instagram.com/p/CzbSELWO9xu/,Imagem do Instagram,Vitalício,98,89,0,10,0,0,,
"Embora a automação de atividades com Inteligência Artificial não seja novidade para processos manuais na indústria, uma perspectiva inovadora propõe iniciar a automação por um setor-chave para qualquer empresa: o pricing. Entre os fatores que justificam essa decisão, estão o aumento de receita e de resultados e boa aceitação das equipes.

Leia o texto no Aprix Journal: acesse bit.ly/461OglL, ou no link da bio.",11/09/2023 05:11,https://www.instagram.com/p/CzbS-4IOYKa/,Imagem do Instagram,Vitalício,117,108,0,8,0,0,,
"Os algoritmos de inteligência artificial possuem a capacidade de analisar uma enorme quantidade de dados de modo ágil e preciso. Tal funcionalidade foi um game changer para diversas áreas de atuação, entre estas a precificação de produtos e serviços.

Dessa forma, instituiu-se o que hoje se conhece como precificação dinâmica. O termo se popularizou durante os últimos anos sobretudo em razão do seu uso por aplicativos de transporte, porém há uma diversidade de aplicações.

O Aprix Journal resolveu explicar três tipos de estratégias de precificação dinâmica.

Leia em https://bit.ly/478GN5y, ou acesse o link na bio.",11/14/2023 04:11,https://www.instagram.com/p/CzoJdPpuvJN/,Imagem do Instagram,Vitalício,145,131,0,9,0,0,,
"O pricing surge a partir dos esforços de diversas áreas correlacionadas, com um objetivo em comum: definir os melhores preços para produtos e serviços. Desse modo, construir uma cultura orientada para o pricing serve para que o processo ou departamento que gera a precificação seja robusto e eficiente.

Entenda como a cultura de pricing beneficia as empresas e conheça os primeiros passos para construí-la.

Leia em: https://aprix.com.br/cultura-de-pricing-o-que-e-e-como-implementar/, ou acesse o link na bio.",11/20/2023 12:11,https://www.instagram.com/p/Cz4b_WEOGT_/,Imagem do Instagram,Vitalício,133,124,0,12,0,0,,
"Vote na Aprix para o Meet the Drapers (@meetthedrapers)

Durante o Web Summit 2023 participamos da gravação deste reality show do qual investidores escolhem as três startups mais promissoras e inovadoras para receber aportes do investidor Tim Draper.

Confira o passo a passo para votar na Aprix:
- acesse o link meetthedrapers.com/vote
- vá à aba da categoria Brazil (Rio de Janeiro) e
- escolha a Aprix e clique em VOTE

Cada email logado é limitado a um voto para uma startup específica. A votação encerra em 16 de dezembro.

Contamos com o seu apoio!",11/21/2023 10:11,https://www.instagram.com/reel/Cz6vGufOpPr/,Reel do Instagram,Vitalício,462,375,2,43,0,1,743,
"De acordo com Paul Hunt, da Pricing Solutions, existem cinco níveis de maturidade em pricing, e apenas 10% das empresas estão nos dois níveis mais avançados. Saiba identificar o que diferencia as empresas no nível “mestre em preços”, que concentra a elite das equipes de precificação, e como isso impacta os resultados da empresa e veja o passo a passo que as empresas devem fazer para chegar a esse nível.

Leia no Aprix Journal. Acesse https://bit.ly/3AgXVbx, ou o link na bio.",11/23/2023 11:11,https://www.instagram.com/p/Cz_-QbGuPJV/,Imagem do Instagram,Vitalício,153,141,0,14,0,0,,
"A colaboração da equipe de pricing com a alta administração e a diferentes áreas é fundamental para garantir resultados mais efetivos e maximização das receitas. Mas empresas que não possuem um setor específico dedicado à área podem enfrentar desafios na estruturação e execução de estratégias de precificação. Portanto, é essencial que as empresas avaliem a necessidade de criar uma área especializada e posicionem-na adequadamente na estrutura organizacional.

Com uma abordagem estratégica e coordenada, as empresas podem aproveitar ao máximo o potencial do pricing e do revenue management para impulsionar seu sucesso financeiro.

Para você, a quem o pricing deve responder?

Para ler a matéria no Aprix Journal, acesse o link na bio, ou https://bit.ly/41PxLH2.",11/28/2023 12:11,https://www.instagram.com/p/C0M9LqWu0Ir/,Imagem do Instagram,Vitalício,111,100,0,8,0,0,,
"O Revenue Growth Management (RGM) está ganhando destaque nas empresas devido à sua abordagem centrada no consumidor, foco na rentabilidade, uso de dados e tecnologia, estratégias integradas e capacidade de resposta às mudanças do mercado.

De acordo com Pedro Fernandes, um dos sócios da Customer Practice da McKinsey Brasil, para se destacar no mercado, empresas devem não somente dominar o uso de ferramentas e metodologias básicas, mas também buscar o aprimoramento constante rumo ao nível mais avançado. Saiba como nesta matéria do Aprix Journal.

Leia em: https://bit.ly/PilaresRGM. Acesse o link na bio.",11/30/2023 11:11,https://www.instagram.com/p/C0SFWZRud_T/,Imagem do Instagram,Vitalício,135,124,0,12,0,0,,
"Você sabe qual é o nível de maturidade do pricing na sua empresa? Entre os cinco níveis de maturidade, a maioria dos negócios chega até o terceiro degrau dessa escada. Paul Hunt, presidente da Pricing Solutions, empresa de estratégia de consultoria em preços, defende que os negócios podem ser divididos em cinco níveis em uma escala de maturidade quanto ao seu processo decisório de precificação.

No Aprix Journal, mostramos quais são as tendências para elevar o nível da maturidade em precificação em 2024. Saiba mais: https://lnkd.in/dNetGihG",12/05/2023 12:12,https://www.instagram.com/p/C0e_kEOOqL1/,Imagem do Instagram,Vitalício,118,109,0,8,0,0,,
"De acordo com Paul Hunt, da Pricing Solutions, existem cinco níveis de maturidade em pricing, e apenas 10% das empresas estão nos dois níveis mais avançados. Saiba identificar o que diferencia as empresas no nível “mestre em preços”, que concentra a elite das equipes de precificação, e como isso impacta os resultados da empresa.

Quais destas características sua empresa tem?

Leia no Aprix Journal. Acesse: https://lnkd.in/dar_4MBV",12/07/2023 11:12,https://www.instagram.com/p/C0kGAvZuK4R/,Imagem do Instagram,Vitalício,128,118,0,7,0,0,,
"Gerenciar preços em vários canais de vendas é uma tarefa desafiadora que exige que as empresas definam estratégias de preços que atraiam os compradores, maximizem o retorno sobre o investimento e monitorem constantemente os preços estabelecidos nos canais de venda.

Uma ferramenta de análise de preços pode ajudar a identificar tendências de preços nos canais de vendas e a medir a eficácia dos esforços de gerenciamento de preços.

Como você lida com este desafio de precificação?

Leia a matéria completa no Aprix Journal: https://bit.ly/3uW4tfg",12/12/2023 11:12,https://www.instagram.com/p/C0w9KMKOj0R/,Imagem do Instagram,Vitalício,97,91,0,5,0,1,,
"O ano de 2024 se apresenta como um período de desafios e oportunidades para o Revenue Management, exigindo das empresas uma visão proativa e adaptável para alcançar o crescimento. Nesse contexto, compreender e antecipar as tendências que moldarão a maximização da receita torna-se fundamental para manter a competitividade e impulsionar o sucesso empresarial.

Saiba mais neste texto do Aprix Journal.
Leia em: https://bit.ly/4awtez8, ou acesse o link na bio.",12/14/2023 09:12,https://www.instagram.com/p/C013-r2OVvl/,Imagem do Instagram,Vitalício,113,105,0,7,0,0,,
"Este ano foi repleto de grandes marcos para a Aprix, tornando-nos uma empresa cada vez mais resiliente e inovadora.  Usamos nossa expertise para criar o maior evento sobre Pricing e RGM do Brasil, além de criar um treinamento para empresas. Em meio ao boom da IA, fomos reconhecidos como uma das principais startups de IA do Brasil!

Em 2023, a Aprix completou cinco anos de atuação em soluções de ciência de dados e de inteligência artificial na precificação. Neste ano, expandimos nossa atuação como plataforma SaaS para o âmbito educacional, promovendo eventos, cursos e parcerias com diversos atores na área. Cada conquista deste ano confirma que estamos no caminho certo para concretizar nossa visão de um mundo mais eficiente.

Leia a matéria completa no Aprix Journal.",12/19/2023 12:12,https://www.instagram.com/p/C1DFBnLuysu/,Imagem do Instagram,Vitalício,331,294,1,24,1,0,,
"Lançamento: Aprix Connect Magazine 📖

O Aprix Connect compartilhou informações valiosas para os profissionais de RGM prepararem-se para os desafios dos próximos anos. Pensando nisso, construímos um conteúdo muito especial com os melhores momentos do evento:
• Takeaways das palestras
• Resumo dos painéis
• Vídeos inéditos
• Momentos de networking

Acesse os principais insights do maior evento de pricing e RGM do Brasil! 
Baixe gratuitamente pelo link na bio ou acesse bit.ly/AprixConnect2023",12/21/2023 13:12,https://www.instagram.com/p/C1IT2_eOHGZ/,Imagem do Instagram,Vitalício,198,173,2,15,0,0,,
"Hoje é dia de conhecer quem entrou na equipe durante o último trimestre de 2023. Boas vindas, novos aprixers! 💙",12/26/2023 10:12,https://www.instagram.com/p/C1U378zufMu/,Carrossel do Instagram,Vitalício,619,468,1,56,0,2,,2
"“Muita coisa aconteceu nos últimos 13.8 bilhões de anos 🎇”

Assim começa o Manifesto Aprix, onde contamos os pilares do nosso propósito de busca por eficiência. Um ano é apenas um recorte no tempo, uma medida humana para tangibilizar acontecimentos. Afinal, de que outra forma poderíamos colocar em perspectiva nossas contribuições para a humanidade, quando ela mesma tem uma jornada de 200 mil anos? 2023 é apenas uma pequena parcela desse processo histórico maior que todos nós.

Ainda assim, quando olhamos para dentro da Aprix, percebemos que, neste intervalo de 365 dias, vivemos momentos inesquecíveis, alcançamos conquistas e construímos etapas muito importantes na nossa história, e que agora são parte fundamental da nossa jornada principal: a busca por eficiência.

No próximo ano, seguiremos empenhados na construção de um mundo mais eficiente. 🚀",12/28/2023 10:12,https://www.instagram.com/p/C1aC3tmuKSO/,Carrossel do Instagram,Vitalício,351,272,13,45,5,0,,
"De acordo com a McKinsey, o pricing é a alavanca de resultados mais imediata nas empresas. Por isso, um dos painéis do Aprix Connect será “O poder do pricing sobre o EBITDA da sua companhia”.

Neste painel, especialistas em pricing discutirão estratégias, ferramentas e práticas de empresas que têm os preços como um dos pilares na geração de resultados.

Um deles é Daniel Bannwart Rago, que tem 5 anos de experiência impulsionando estratégias de negócios em grandes empresas de FMCG e grandes indústrias. 

🎟 Os ingressos para o evento estão esgotados, mas você pode entrar na fila de espera, acessando o link: bit.ly/AprixConnect2023, ou o link na bio.",10/02/2023 13:10,https://www.instagram.com/p/Cx6MwrcuSWT/,Imagem do Instagram,Vitalício,225,193,0,7,0,0,,
"Estamos na Rio Innovation Week! 💡 🚀 

A @rioinnovationweek é um evento que acontece no Rio de Janeiro e reúne empreendedores, startups, investidores, acadêmicos, profissionais da área de tecnologia e interessados em geral para discutir e compartilhar ideias sobre as últimas tendências e avanços no campo da inovação.

A Aprix estará no palco duas vezes durante o evento:

03/10 | @vargascorrea integra o painel “Alavancando resultados através do pricing com Inteligência Artificial”.

05/10 | @queirozber participa da Sessão Técnica sobre Indústria, apresentando o case “Como uma indústria FMCG gerou R$151,24 milhões em oportunidades em um ano com otimização do pricing”.

Se você estiver no evento, venha trocar ideias conosco ou aprender mais sobre o futuro do pricing no Brasil! 🏷",10/03/2023 12:10,https://www.instagram.com/p/Cx8vGp4O8xY/,Carrossel do Instagram,Vitalício,358,250,0,21,4,0,,
"O Aprix Connect surgiu para criar um ambiente de troca entre os principais nomes do pricing e RGM no Brasil.

O evento visa fomentar um ambiente plural de discussões sobre pricing, protagonizadas pelos decisores das maiores companhias de bens de consumo, consultorias e empresas de tecnologia. Será uma oportunidade para profissionais se atualizarem sobre as principais tendências de Pricing e RGM no país, a partir da união de diferentes perspectivas sobre a disciplina.

Data: 17/10/23
Horário: 14h — 19h
Local: São Paulo| STATE Innovation Center

Ingressos limitados! 
Mais informações pelo link na bio.
Ou acesse: bit.ly/AprixConnect2023",09/06/2023 06:09,https://www.instagram.com/p/Cw2hxK-uiDh/,Carrossel do Instagram,Vitalício,517,406,10,41,2,0,,
"Estamos com vagas abertas para estágio em Machine Learning Engineer e Full Stack Developer! 🚀

Procuramos pessoas para, junto do time de desenvolvimento, ajudar em nossa missão: desenvolver soluções de data science que auxiliem agentes de diferentes portes e segmentos a solucionar problemas na busca por maior eficiência. 

Saiba mais sobre as vagas nos cards. 

Curtiu? Envie o seu currículo para careers@aprix.com.br",07/19/2023 10:07,https://www.instagram.com/p/Cu40J-uOqyd/,Carrossel do Instagram,Vitalício,697,512,19,55,1,2,,
