Descrição,Horário de publicação,Link permanente,Tipo de publicação,Data,Impressões,Alcance,Compartilhamentos,Curtidas,Comentários,Salvamentos,Seguimentos,Reproduções
"Em um dos paineis do Aprix Connect, especialistas debaterão sobre a importância de alinhar a visão estratégica da alta gestão das companhias com a execução do dia a dia das áreas de pricing e comercial. A governança organizacional e de preços será discutida como elemento essencial para a cultura de RGM, com foco na necessidade de alinhar visões e metas entre os departamentos. Especificamente, será abordada a relação da área de pricing com as estruturas financeiras e de vendas das grandes companhias.

No Aprix Connect, Thiago Menezes vai dividir o palco com outros grandes especialistas para falar sobre cultura. Thiago é responsável pelo pricing nacional na Ambev. Possui experiência em vendas com foco em precificação, estratégia e planejamento. Possui vivência multidisciplinar com profissionais de logística, financeiro, marketing, gestão e vendas. 
 
🎟 Os ingressos para o evento estão esgotados, mas você pode entrar na fila de espera, acessando o link: bit.ly/AprixConnect2023",09/29/2023 11:09,https://www.instagram.com/p/CxyQNFvO4vm/,Imagem do Instagram,Vitalício,232,206,0,9,0,0,,
"No Aprix Connect, mostraremos abordagens práticas de como o pricing pode atuar como catalisador para potencializar os resultados financeiros na indústria FMCG, garantindo um EBITDA saudável e promovendo um crescimento sustentável. 

Luis Barreto Bisneto, diretor de Revenue Management na M. Dias Branco, apresentará a palestra “Pricing gerando EBITDA: estruturação de uma área de pricing em uma indústria FMGC”. O especialista discutirá a importância da análise de mercado, da avaliação da concorrência e da compreensão da percepção de valor do cliente.

Do ponto de vista interno, Bisneto abordará a estruturação de equipes de pricing orientadas para um papel estratégico a partir de casos reais.

🎫 Os ingressos para o evento estão esgotados, mas você pode entrar na fila de espera pelo link: bit.ly/AprixConnect2023, ou no link da bio.",09/27/2023 08:09,https://www.instagram.com/p/CxsxWjUOFmU/,Imagem do Instagram,Vitalício,228,207,0,17,0,0,,
"No painel ""O poder do pricing sobre o EBITDA da sua companhia"", especialistas em pricing discutirão estratégias, ferramentas e práticas de empresas que têm os preços como um dos pilares na geração de resultados.

Diana Serra é gerente de Pricing na Unilever. Possui experiência na área financeira, apoiando processos de negócios como marketing, supply chain, compras e finanças corporativas.

🎫 Os ingressos para o evento estão esgotados, mas você pode entrar na fila de espera. Confira mais informações na página do evento. 

Acesse bit.ly/AprixConnect2023, ou o link da bio.",09/25/2023 11:09,https://www.instagram.com/p/Cxn-XD7ued9/,Imagem do Instagram,Vitalício,182,168,0,12,0,0,,
"No painel “Como criar uma cultura de RGM na sua companhia?”, especialistas destacarão a importância de alinhar as estratégias de pricing com a alta gestão da empresa, oferecendo insights para implementar práticas eficazes de RGM e impulsionar o crescimento sustentável.

Quem completa o painel é Fernando Henrique Martins, diretor de Revenue Growth Management na Bimbo Brasil, com mais de 15 anos de experiência na área de gestão de receita e pricing em grandes empresas de bens de consumo. Prioriza inovação e alto padrão de qualidade, criando valor para stakeholders.

🎟️ Os ingressos para o evento estão esgotados, mas você pode entrar na fila de espera. Acompanhe a Aprix para aprender cada vez mais sobre inovação no universo de RGM.

Mais informações pelo link: bit.ly/AprixConnect2023, ou no link da bio.",09/22/2023 10:09,https://www.instagram.com/p/CxgK5fBO1Pv/,Imagem do Instagram,Vitalício,216,194,0,14,0,0,,
"De acordo com a McKinsey, o pricing é a alavanca de resultados mais imediata nas empresas. No painel “O poder do pricing sobre o EBITDA da sua companhia”, especialistas em pricing discutirão estratégias, ferramentas e práticas de empresas que têm os preços como um dos pilares na geração de resultados.

Um dos painelistas é Victor Godinho, head de Revenue Management na Diageo, com uma carreira focada em impulsionar estratégias de negócios e crescimento de receitas. A Diageo é líder global em bebidas premium, a multinacional britânica opera em diversos mercados ao redor do mundo e tem uma presença significativa na indústria de bebidas alcoólicas. A empresa possui mais de 200 marcas vendidas em 180 países.

Os ingressos para o evento estão esgotados, mas você pode entrar na fila de espera. Acompanhe a Aprix para aprender cada vez mais sobre inovação no universo de RGM.

Mais informações pelo link: bit.ly/AprixConnect2023, ou no link da bio.",09/21/2023 10:09,https://www.instagram.com/p/Cxdj3JVOtUL/,Imagem do Instagram,Vitalício,218,199,1,15,0,0,,
"A estratégia de precificação dinâmica, uma abordagem que ganha cada vez mais relevância devido à sua alta eficácia, foi primeiramente implementada no setor da aviação pela American Airlines. De acordo com Steffen Christ, autor do livro “Operacionalizando Modelos de Precificação Dinâmica”, a empresa relatou um impressionante ganho anual de USD 500 milhões graças à adoção de sistemas de preços dinâmicos. 

Essa inovação reinventou a forma como as empresas capturam valor por seus produtos e serviços através da inovação. Inspirado por essa revolucionária experiência, foi criado o logo do Aprix Connect. Através das formas do logotipo da Aprix foi desenvolvido o ícone semelhante a um avião — você já tinha reparado? —, prestando homenagem ao setor onde nasceu a precificação baseada em valor. 

A Aprix tem como base o protagonismo pela busca de soluções inovadoras para ganhos de eficiência. Em especial, queremos estender a vários mercados a possibilidade de controlar seus resultados estabelecendo preços assertivos.  Assim, no intuito de fortalecer o ecossistema de pricing brasileiro, o Aprix Connect surge com a ambição de ser o maior espaço para a discussão de pricing no Brasil, em seu nível mais avançado. 

Leia os cards acima e entenda o processo por trás da criação do evento. ️

Os ingressos estão esgotados, mas você pode entrar na fila de espera pelo link bit.ly/AprixConnect2023",09/19/2023 07:09,https://www.instagram.com/p/CxYHCQbOKIa/,Carrossel do Instagram,Vitalício,278,215,0,28,0,0,,
"Profissionais altamente experientes estarão em diálogo durante os painéis do Aprix Connect. No tema “Como criar uma cultura de RGM na sua companhia?”, uma das especialistas é Ana Efigênia Souza Barros.

Ana Efigênia é uma profissional especializada em Pricing e Revenue Management com mais de 20 anos de experiência liderando áreas e projetos em grandes empresas nos setores B2C, B2B, serviços e commodities. Aborda desde a criação até a estruturação do setor, incorporando operações e táticas de pricing e RM.

Os especialistas destacarão a importância de alinhar as estratégias de pricing com a alta gestão da empresa, oferecendo insights para implementar práticas eficazes de RGM e impulsionar o crescimento sustentável. 

🎫 Os ingressos para o evento estão esgotados, mas você pode entrar na fila de espera. Acompanhe a Aprix para aprender cada vez mais sobre inovação no universo de RGM.

Mais informações pelo link: bit.ly/AprixConnect2023, ou no link da bio.",09/15/2023 11:09,https://www.instagram.com/p/CxOMfnbuhWI/,Imagem do Instagram,Vitalício,344,310,0,23,0,0,,
"Conheça os nomes que estarão no palco do Aprix Connect para compartilhar sua experiência em Revenue Growth Management.

Pedro Fernandes é um dos líderes da prática de Consumo e Varejo da McKinsey no Brasil. Seu foco é em RGM e Go-to-market para CPG, e em sua experiência prévia à McKInsey liderou essas áreas em uma multinacional do setor.

Em sua palestra, intitulada “Desafios de RGM para empresas de consumo em 2023-24”, Pedro abordará as complexidades e oportunidades que as empresas de bens de consumo enfrentam para impulsionar o crescimento de receitas nos próximos anos, considerando o panorama e as particularidades do Brasil. Também falará sobre as capacitações que têm sido desenvolvidas pelas empresas que estão mais avançadas na sua jornada, incluindo a utilização de novas fontes de dados e inteligência artificial.

Garanta seu ingresso!
Mais informações pelo link: bit.ly/AprixConnect2023, ou no link da bio.",09/13/2023 09:09,https://www.instagram.com/p/CxI6LlbuCJ1/,Imagem do Instagram,Vitalício,320,270,1,20,0,0,,
"Na última semana de agosto, demos início oficial a um novo projeto em colaboração com a Fruki Bebidas, marca com presença significativa na região sul do Brasil. Nossa meta conjunta é o fortalecimento das práticas de Revenue Growth Management, agilizar o processo de precificação e aperfeiçoar o controle da execução das estratégias de preços da companhia.

Esperamos gerar mais eficiência, automatizando os processos de decisão e ajuste de preços e promoções, além de fornecer suporte para decisões mais preditivas e granulares.

Estamos muito empolgados com essa fase inicial e mantemos uma confiança sólida de que essa parceria trará resultados excepcionais para ambas as organizações!",09/12/2023 10:09,https://www.instagram.com/p/CxGakehuZSs/,Imagem do Instagram,Vitalício,673,607,7,67,1,1,,
"Para evitar que custos defasados gerem erros na precificação, o sistema da Aprix ajuda na coleta e no monitoramento de preços na ponta. Isso possibilita que os clientes da Aprix analisem dados atualizados para estarem conectados com suas estratégias e também com o que o mercado está praticando.

O CEO da Aprix, Guilherme Zuanazzi, participou do ITS Cast e comentou sobre esse assunto. 

O episódio completo do podcast da @itsgroupoficial, com foco em inovação, processo, tecnologia e tendências do mercado SAP, pode ser acessado no link na bio!",04/06/2023 11:04,https://www.instagram.com/reel/CqtDl9BpzQ6/,Reel do Instagram,Vitalício,542,404,0,38,0,0,514,
"O uso da inteligência artificial é uma questão complexa que envolve diversas implicações éticas e sociais. É importante reconhecer que a IA é uma ferramenta desenvolvida e utilizada por seres humanos, e que, portanto, está sujeita aos vieses e preconceitos que fazem parte da nossa sociedade.

Em entrevista ao Aprix Journal, professor e pesquisador do Instituto de Pesquisas Tecnológicas Adriano Leal falou sobre o desenvolvimento ético de soluções em IA. 

Leia a entrevista completa em http://bit.ly/4066WNW, ou acesse o link na bio.",04/13/2023 06:04,https://www.instagram.com/p/Cq-i7eQOb34/,Imagem do Instagram,Vitalício,224,200,0,21,0,0,,
"O amadurecimento do processo de pricing pode ser uma ferramenta poderosa para impulsionar resultados em grandes empresas. 

Acesse agora o White Paper e saiba como uma indústria de bens de consumo rápido gerou R$151,24 milhões em oportunidades em um ano com otimização do pricing! Entenda qual era o cenário anterior e qual foi a abordagem da Aprix para atingir esse resultado. 

Acesse o link na bio e baixe gratuitamente!",04/17/2023 13:04,https://www.instagram.com/p/CrJmewaOQKC/,Carrossel do Instagram,Vitalício,230,180,0,21,0,0,,
"A estratégia de gestão de receita visa analisar e controlar os preços e a disponibilidade dos seus produtos ou serviços para aumentar a lucratividade. Com a aplicação do Revenue Management e do Pricing, é possível melhorar a rentabilidade, posicionar-se competitivamente no mercado, gerenciar recursos com mais eficiência e satisfazer as necessidades dos clientes. 

Saiba como aplicá-las e impulsionar o seu negócio a longo prazo nesta matéria do Aprix Journal. Leia em:  https://bit.ly/3UJbTLP, ou acesse o link na bio.",04/18/2023 12:04,https://www.instagram.com/p/CrMGWvUO-li/,Imagem do Instagram,Vitalício,151,130,0,12,0,0,,
"Para que o crescimento do negócio acompanhe o do time, a abordagem da Aprix é considerar as pessoas um indicador tão importante para a saúde da empresa quanto receita e margem.

Este foi um dos pontos abordados pelo CEO da Aprix, Guilherme Zuanazzi, no painel “Estratégias para a Retenção de Talentos”, no South Summit Brazil 2023. Na primeira edição do evento, em 2022, recebemos o prêmio de Melhor Time da Competição de Startups, entre mais de 1000 empresas avaliadas. A partir desse reconhecimento da valorização do time, um aspecto já consolidado em nossa cultura, Zuanazzi foi convidado a compartilhar a experiência da Aprix com o público do evento.

Assista o vídeo e escute a fala completa.",04/19/2023 13:04,https://www.instagram.com/reel/CrOve0UN75w/,Reel do Instagram,Vitalício,341,294,1,34,1,1,327,
"Uma precificação bem estruturada é fundamental para o sucesso de qualquer negócio. Ela pode definir o valor do seu produto ou serviço no mercado, garantir sua competitividade e até mesmo impulsionar suas vendas. Para executar uma precificação assertiva, é essencial ter um processo de precificação robusto.

Entenda nesta matéria do Aprix Journal. Acesse bit.ly/3oxqXQp, ou o link na bio.",04/20/2023 11:04,https://www.instagram.com/p/CrRMlX4Oboc/,Imagem do Instagram,Vitalício,131,116,0,7,0,0,,
"O processo de consolidação de dados é normalmente realizado manualmente pelo time de pricing, o que o torna suscetível a erros e consome muito tempo da equipe. Em um cenário de inflação alta e dinamismo no mercado, esse tempo pode ser crucial para determinar o posicionamento de preços.

Saiba como otimizar esse processo no Aprix Journal. Para ler o texto completo, acesse https://bit.ly/3beoB2E ou link na bio.",04/24/2023 07:04,https://www.instagram.com/p/Cra-hAGuAnC/,Carrossel do Instagram,Vitalício,189,155,1,18,0,0,,
"Empresas brasileiras que possuem ações negociadas nas bolsas americanas precisam estar em conformidade com a lei SOx. se quiserem aumentar a confiança dos investidores nas informações financeiras divulgadas pela empresa e manter sua listagem na bolsa de valores. A implementação dos controles internos e a realização de auditorias independentes exigidas pela SOX podem representar um desafio para as empresas, mas podem aumentar a confiança dos investidores e valorizar as ações da empresa.

Entenda  a importância da Lei SOx para as corporações brasileiras neste texto do Aprix Journal. Acesse https://bit.ly/3LDODfr, ou o link na bio.",04/25/2023 11:04,https://www.instagram.com/p/CreFB4OuXWg/,Imagem do Instagram,Vitalício,166,148,0,11,0,0,,
"Apesar dos avanços que vêm acontecendo na maturidade de pricing das empresas, existe um grande gap a ser explorado no Brasil. O CEO da Aprix, @guilhermezuanazzi, participou do ITS Cast e comentou sobre como a tecnologia auxilia empresas a elevar a sofisticação do processo de pricing.

O ITS Cast é o podcast da @itsgroupoficial focado em inovação, processo, tecnologia e tendências do mercado SAP. O episódio completo pode ser acessado neste link: youtu.be/fjkARgKbN7M",04/26/2023 12:04,https://www.instagram.com/reel/Crgrs0DteZz/,Reel do Instagram,Vitalício,543,409,1,37,0,0,502,
"O preço é um dos fatores mais importantes que afetam a decisão dos clientes de permanecerem ou não fiéis a uma empresa. Para que o preço atue na retenção de clientes, é importante que a empresa ofereça um preço justo e competitivo, levando em consideração a qualidade dos produtos ou serviços oferecidos e o preço praticado pelos concorrentes. Além disso, é importante que a empresa seja transparente em relação aos preços e evite surpresas desagradáveis.

Saiba mais no Aprix Journal. Acesse https://bit.ly/3L5CH4g ou link na bio.",04/27/2023 12:04,https://www.instagram.com/p/CrjPdemOS6-/,Imagem do Instagram,Vitalício,165,152,0,11,0,0,,
"Saiba o que foi assunto no Aprix Journal na última semana 📰

O Revenue Management é um dos temais mais abordados pelo Aprix Journal. Mas você sabe o que significa? O Aprix Journal explica esse conceito central na gestão de um pricing estratégico.

Além disso, o AJ mostrou como um processo de precificação robusto pode beneficiar a empresa em várias frentes, inclusive na retenção de clientes.

De olho no mercado internacional, também falamos sobre a Lei SOX, que regulamenta a bolsa de valores dos EUA, e qual é a vantagem de grandes empresas brasileiras adequarem-se a ela.

Leia todas as matérias do Aprix Journal em aprix.com.br/journal",05/02/2023 12:05,https://www.instagram.com/p/CrwHWmduVgB/,Carrossel do Instagram,Vitalício,179,141,0,20,0,0,,
"O futuro está sendo construído no Web Summit! 🚀

Estamos animados em participar deste grande evento do ecossistema de inovação e tecnologia, que reúne milhares de palestrantes e empresas de todo o mundo em busca de soluções inovadoras.

Hoje, em especial, é um grande dia! Vamos gravar um episódio do reality show “Meet the Drapers” e estamos com um estande no pavilhão 3, ao lado do palco FullSTK. 

Se você está presente no evento, não deixe de nos fazer uma visita.",05/03/2023 09:05,https://www.instagram.com/p/CrydNN8uhQL/,Imagem do Instagram,Vitalício,332,286,4,48,0,0,,
"Uma pesquisa realizada pela BCG apontou alguns dos maiores desafios enfrentados por empresas que buscam resultados excelentes em pricing. A conclusão indica que desenvolver cuidadosamente a estratégia de precificação adequada, táticas de execução, ferramentas e insights, e organização de precificação corretos, qualquer empresa pode aumentar significativamente sua maturidade em pricing. Juntar todos esses elementos leva tempo e esforço, mas pode criar um valor extraordinário.

Foram consultadas empresas de vários setores, incluindo bens industriais, tecnologia, consumo, energia, serviços financeiros e saúde.

Leia a matéria completa no Aprix Journal. Acesse: https://bit.ly/3LS1gDx, ou o link na bio.",05/03/2023 11:05,https://www.instagram.com/p/CrypKkMOTzC/,Imagem do Instagram,Vitalício,167,149,0,10,0,0,,
"Muitas empresas enfrentam dificuldades em transformar seus preços em uma fonte de vantagem competitiva por falta de funcionários com habilidades e treinamentos adequados. Além disso, elas também têm dificuldades em decidir onde posicionar a função de precificação dentro da organização e como centralizá-la.

Leia a matéria completa no Aprix Journal. Acesse https://bit.ly/3LBi8NC, ou o link na bio.",05/04/2023 11:05,https://www.instagram.com/p/Cr1NWg7OhWh/,Imagem do Instagram,Vitalício,145,136,0,9,0,0,,
"A elasticidade é o coeficiente que mede a resposta do público consumidor às alterações de preço. Especialistas consultados pelo Aprix Journal ressaltam sua centralidade nas decisões de preço e a importância de medi-lo com os melhores recursos e bases de dados disponíveis.

Em tese, o cálculo da elasticidade de preço da demanda é simples: basta dividir a variação de preço pela variação na demanda.

No entanto, fatores qualitativos tornam essa realidade muito mais complexa — o que não impede as empresas de fazer uma análise precisa, caso tenham as ferramentas certas.",05/08/2023 07:05,https://www.instagram.com/p/Cr_FwUYu0kY/,Carrossel do Instagram,Vitalício,310,256,0,17,0,1,,
"Aprix no Web Summit Rio! 🚀

Foram quatro dias intensos imersos em um ambiente de inovação e criatividade junto de empreendedores, pesquisadores e investidores que estão construindo o futuro! Tivemos o privilégio de assistir grandes mentes da tecnologia compartilhando seu conhecimento conosco e de construir e fortalecer relações nesse ecossistema.

Durante o evento, disputamos a competição PITCH!, participamos do reality show ”Meet the Drapers”, encontramos grandes parceiros e fizemos conexões incríveis.

O Web Summit é um dos maiores eventos do ecossistema de inovação e tecnologia no mundo. Nesta edição, sediada no Rio de Janeiro, a conferência reuniu mais de 20 mil pessoas, entre elas palestrantes, participantes, executivos e entusiastas da tecnologia de todo o mundo em busca de soluções inovadoras.

Agradecemos as visitas em nosso estande, a receptividade dos parceiros e a todos que nos acompanharam na última semana!",05/09/2023 13:05,https://www.instagram.com/p/CsCVSjgOPR1/,Carrossel do Instagram,Vitalício,820,646,1,100,4,1,,
"A Aprix participou dos quatro dias do Web Summit Rio, o maior evento de tecnologia do Brasil. Palestras inspiradoras com grandes especialistas do mercado discutiram inovação, tecnologia, sustentabilidade e o futuro da inovação. Além disso, a Aprix também fez conexões valiosas, apresentou suas soluções e participou da gravação do reality show Meet the Drapers. Foi uma oportunidade única para estar em contato com as últimas tendências e inovações do mercado.

Leia a matéria completa no Aprix Journal. Acesse http://bit.ly/3HYBvPB, ou o link na bio.",05/10/2023 11:05,https://www.instagram.com/p/CsErhlUuLM0/,Imagem do Instagram,Vitalício,303,259,0,12,0,0,,
"Na semana passada fizemos uma visita à sede da @vibraenergiaoficial, grande parceira e usuária das soluções Aprix. As equipes pricing da Lubrax e de Custos dos combustíveis utilizam as soluções Aprix para ganhos de eficiência nas suas operações.

Ficamos honrados em fazer parte do processo de amadurecimento da estrutura de Revenue Management da Vibra!

Agradecemos pela agradável recepção, especialmente ao Diego, Isabela, Marcelo, Aurélio, Theodomiro, Gustavo, Danilo, Leonardo e Marcio.",05/11/2023 06:05,https://www.instagram.com/p/CsGvRJdOcx1/,Imagem do Instagram,Vitalício,798,679,0,98,2,0,,
"O FED, o Banco Central Americano, elevou os juros pela décima vez consecutiva em meio a um cenário de inflação acima da meta de 2%, recuperação econômica pós-pandemia e guerra na Ucrânia. O anúncio aconteceu dois meses depois da quebra do Silicon Valley Bank, que dividiu as perspectivas de economistas. 

Entenda como a inflação nos EUA pode frear o consumo no Brasil e quais são as alternativas para enfrentar esse cenário

Leia no Aprix Journal. Acesse https://bit.ly/3BjL1sS, ou o link na bio",05/11/2023 12:05,https://www.instagram.com/p/CsHVgH5uZJG/,Imagem do Instagram,Vitalício,219,196,0,8,0,0,,
"Saiba o que foi assunto no Aprix Journal na última semana 📰

— Os maiores desafios da precificação: com tempo e esforço, superá-los pode criar um valor extraordinário para a empresa;
— Funcionários com habilidades e treinamentos adequados são uma vantagem competitiva, 
— A Aprix esteve no Web Summit Rio 2023, maior conferência do ecossistema de tecnologia no país, e falou de sua experiência no evento.
— O FED, o Banco Central dos EUA, elevou os juros pela décima vez consecutiva. Saiba como isso pode frear o consumo no Brasil e quais são as alternativas para enfrentar esse cenário.

Leia todas as matérias do Aprix Journal em aprix.com.br/journal",05/12/2023 12:05,https://www.instagram.com/p/CsJ6SBnOJ47/,Carrossel do Instagram,Vitalício,168,133,0,18,0,0,,
"Um dos desafios de quem trabalha com pricing é o de interagir com vários setores da empresa (como vendas, marketing, trade marketing, finanças, fiscal, entre outros), e estabelecer estratégias que equilibrem os objetivos de cada uma delas.

Pensando nisso, Ana Efigênia de Souza Barros, consultora de projetos de pricing e go-to-market e pós-graduanda em Neurociência pela Universidade Presbiteriana Mackenzie, compartilhou com o Aprix Journal alguns indicadores que profissionais de pricing devem acompanhar.

Para ler a matéria no Aprix Journal, acesse o link na bio, ou bit.ly/3z5woJK",05/16/2023 10:05,https://www.instagram.com/p/CsT9A8IOK27/,Imagem do Instagram,Vitalício,155,140,0,6,0,0,,
"Comentamos anteriormente sobre os crawlers desenvolvido pela Aprix, que monitoram preços ao consumidor final, mas o verdadeiro diferencial da nossa tecnologia está em entregar aos nossos clientes dados públicos de diferentes bases de forma estruturada e organizada, gerando eficiência e agilidade.

O CEO da Aprix, @guilhermezuanazzi, participou do ITS Cast e comentou sobre a importância de adquirir dados de diferentes bases e conseguir cruzá-los para realizar uma análise mais detalhada e assertiva.

O ITS Cast é o podcast da @itsgroupoficial focado em inovação, processo, tecnologia e tendências do mercado SAP. O episódio completo pode ser acessado no link da bio.",05/18/2023 06:05,https://www.instagram.com/reel/CsYumjorXo8/,Reel do Instagram,Vitalício,366,309,0,36,1,0,349,
"A colaboração da equipe de pricing com a alta administração e a diferentes áreas é fundamental para garantir resultados mais efetivos e maximização das receitas. Mas empresas que não possuem um setor específico dedicado à área podem enfrentar desafios na estruturação e execução de estratégias de precificação. Portanto, é essencial que as empresas avaliem a necessidade de criar uma área especializada e posicionem-na adequadamente na estrutura organizacional. 

Com uma abordagem estratégica e coordenada, as empresas podem aproveitar ao máximo o potencial do pricing e do revenue management para impulsionar seu sucesso financeiro.

Para você, a quem o pricing deve responder?

Para ler a matéria no Aprix Journal, acesse o link na bio, ou https://bit.ly/41PxLH2.",05/18/2023 10:05,https://www.instagram.com/p/CsZMMXouorJ/,Imagem do Instagram,Vitalício,366,314,0,9,0,0,,
