Descrição,Horário de publicação,Link permanente,Tipo de publicação,Data,Impressões,Alcance,Compartilhamentos,Curtidas,Comentários,Salvamentos,Seguimentos,Reproduções
"Nossa equipe comercial esteve na APAS Show 2023, o maior evento de alimentos e bebidas das Américas e maior feira de supermercados do mundo. Foi uma experiência única para divulgar as soluções da Aprix, compatíveis com as dores de precificação que muitas das empresas presentes no evento enfrentam diariamente. 

Enxergamos no setor um potencial imenso de geração de resultados, diretamente no Ebitda dessas companhias, por meio da automação das atividades e da otimização das decisões de pricing. Com isso, esperamos que cada vez mais empresas possam contar com nossa plataforma para ter processos de precificação robustos e eficientes.

Você esteve por lá? Compartilhe conosco sua visão do evento!",05/22/2023 13:05,https://www.instagram.com/p/Csjz3xHuFT3/,Carrossel do Instagram,Vitalício,790,621,2,81,3,0,,
"Notícias recentes destacam a crescente relevância da Inteligência Artificial e do Aprendizado de Máquina nos negócios. Com a evolução tecnológica contínua e a disponibilidade de dados, CEOs reconhecem que a IA transformará a forma como fazemos negócios. Atualmente, empresas conseguem combinar estratégias de precificação e IA impulsionar seus resultados financeiros, otimizando decisões, reduzindo tempo de mercado e aumentando a eficácia das promoções.

Para você, qual é o futuro da precificação?

Leia a matéria completa no Aprix Journal. Acesse https://bit.ly/3os4QLL, ou o link na bio.",05/24/2023 11:05,https://www.instagram.com/p/Csotr4fOhYh/,Imagem do Instagram,Vitalício,350,303,0,5,0,0,,
"Na última semana, fizemos o kick off de um novo projeto em parceria com a Farma Conde, rede de farmácias em São Paulo com rápida expansão. Juntos, buscaremos aumentar a rentabilidade da companhia através do reforço da disciplina de Revenue Management dentro da operação, com o foco no ganho de agilidade operacional na precificação.

Estamos entusiasmados com essa nova etapa e confiantes de que essa parceria trará resultados extraordinários para ambas as empresas.",05/25/2023 05:05,https://www.instagram.com/p/CsqpxHngNfL/,Imagem do Instagram,Vitalício,590,529,0,62,3,0,,
"Definir o preço certo para um produto ou serviço e escolher a estratégia de pricing adequada é fundamental para maximizar a receita e garantir o sucesso de uma empresa. Cada abordagem pode ser testada e adaptadas de acordo com o mercado e público-alvo para encontrar a melhor solução para o negócio.

Leia a matéria completa no Aprix Journal. Acesse https://bit.ly/42fTjgA, ou o link na bio.",05/25/2023 12:05,https://www.instagram.com/p/CsrVUsdOE2k/,Imagem do Instagram,Vitalício,243,209,0,11,0,1,,
"Acompanhe as últimas novidades no Aprix Journal desta semana! 📰

— O caminho para o sucesso financeiro: saiba como a abordagem estratégica e coordenada do pricing pode impulsionar o seu negócio.

— A era da precificação inteligente: saiba como a Inteligência Artificial e o Aprendizado de Máquina estão transformando o cenário dos negócios.

— Maximize sua receita e garanta o sucesso: aprenda a definir o preço certo para seu produto ou serviço e escolha a estratégia de pricing adequada.

Leia todas as matérias do Aprix Journal em aprix.com.br/journal ou no link da bio.",05/26/2023 11:05,https://www.instagram.com/p/Cst3_QQOFPC/,Carrossel do Instagram,Vitalício,377,320,0,14,0,0,,
"Você sabia que a Aprix existe graças ao programa de dupla diplomação da École Centrale? Foi a partir da experiência de nossos fundadores na França com tecnologias de ponta em precificação, usadas por empresas globais, que veio a ideia de trazer essas ferramentas para o Brasil. 

E é por isso que estamos muito felizes em ter participado da feira de carreiras da École Centrale, em São Paulo! Muitas pessoas que integram nossa equipe também passaram pelo DD. De volta ao Brasil, se identificaram com a mentalidade e os valores da Aprix e encontraram um ambiente promissor para seu desenvolvimento. Confira alguns depoimentos nas imagens. 

Nossa presença na feira é uma forma de retribuir às universidades, por isso, nos comprometemos em dar espaço para que mais estudantes de graduação continuem a evolução de suas carreiras aqui no Brasil. 

O que você acha dessa parceria?🤩",06/07/2023 13:06,https://www.instagram.com/p/CtM6rIru_Du/,Carrossel do Instagram,Vitalício,959,682,5,92,2,1,,
"A estratégia de gestão de receita visa analisar e controlar os preços e a disponibilidade dos seus produtos ou serviços para aumentar a lucratividade. Com a aplicação do Revenue Management e do Pricing, é possível melhorar a rentabilidade, posicionar-se competitivamente no mercado, gerenciar recursos com mais eficiência e satisfazer as necessidades dos clientes.

Saiba como aplicá-las e impulsionar o seu negócio a longo prazo nesta matéria do Aprix Journal. Leia em: https://bit.ly/3UJbTLP, ou acesse o link na bio.",06/12/2023 13:06,https://www.instagram.com/p/CtZ0MMhOXZu/,Carrossel do Instagram,Vitalício,320,269,0,15,0,0,,
"Sistemas de precificação podem simplificar o cálculo de impostos, tornando-o mais confiável, preciso e eficiente. Este também é o objetivo da reforma tributária, que pretende reduzir custos e aumentar competitividade das empresas. O grupo de trabalho da Câmara dos Deputados apresentou o relatório com as principais diretrizes que nortearão a elaboração da proposta de emenda constitucional (PEC), que será levada ao plenário em julho.

Para você, a reforma proposta é positiva ou negativa?

Leia a matéria completa no Aprix Journal. Acesse https://bit.ly/3qAMed4, ou o link na bio.",06/14/2023 08:06,https://www.instagram.com/p/CteceG3OCu5/,Imagem do Instagram,Vitalício,167,149,0,11,0,0,,
"A equipe da Aprix é formada por pessoas alinhadas a um propósito: gerar eficiência com ciência de dados. No dia a dia, os Aprixers trabalham sabendo que estão ajudando a resolver problemas complexos e criando valor.

Para enfrentar os desafios que nos motivam, precisamos de soluções fora da curva. A diversidade, a equidade e o protagonismo na transformação são intrínsecos à cultura da Aprix e nos permitem alcançar excelentes resultados constantemente.

Essas foram algumas premissas apresentadas pelo CEO da Aprix, @guilhermezuanazzi, no painel “Estratégias para a Retenção de Talentos”, no @southsummitbrazil 2023. Em 2022, a Aprix foi reconhecida com o prêmio de Melhor Time da Competição de Startups do South Summit Brazil.",06/15/2023 09:06,https://www.instagram.com/reel/CthHPTzN2RI/,Reel do Instagram,Vitalício,368,324,2,29,0,0,353,
"Com que frequência você usa a elasticidade de preços na tomada de decisões?

A elasticidade de preços é um dos dados mais importantes para uma precificação assertiva. Ainda assim, muitas empresas não o priorizam no cálculo de preços, e olham mais para outros dados, como custos e concorrência. 

Nesta matéria do Aprix Journal, especialistas ressaltam sua centralidade nas decisões de preço e a importância de medi-lo com as melhores ferramentas e bases de dados disponíveis. Leia em: https://bit.ly/3RFyG85, ou no link da bio.",06/16/2023 05:06,https://www.instagram.com/p/CtjPai0uYxh/,Imagem do Instagram,Vitalício,184,160,0,7,0,0,,
"Na Aprix, nós reconhecemos e respeitamos o valor das diferenças humanas e trabalhamos para sustentar um ambiente onde todas as pessoas possam ser quem são. 

Por isso, a diversidade faz parte dos indicadores chave que acompanhamos para medir o sucesso das nossas estratégias. 

O que você acha dessa iniciativa?

Saiba mais na matéria do Aprix Journal. 
Leia em bit.ly/3CWtF6l, ou acesse o link na bio.

#pride",06/20/2023 11:06,https://www.instagram.com/p/CtuNw-5OsRc/,Carrossel do Instagram,Vitalício,277,214,6,28,1,0,,
"Com que frequência você usa a elasticidade de preços na tomada de decisões?

A elasticidade de preços é um dos dados mais importantes para uma precificação assertiva. Ainda assim, muitas empresas não o priorizam no cálculo de preços, e olham mais para outros dados, como custos e concorrência.

Nesta matéria do Aprix Journal, especialistas ressaltam sua centralidade nas decisões de preço e a importância de medi-lo com as melhores ferramentas e bases de dados disponíveis.

Leia em: https://lnkd.in/du75K7bZ, ou no link da bio.",06/21/2023 11:06,https://www.instagram.com/p/CtwyglCuehy/,Imagem do Instagram,Vitalício,249,226,0,10,0,0,,
"Na semana passada, estivemos com a equipe de pricing da Dexco para realizar o curso especializado em Pricing e Revenue Management da Aprix, que trata do uso de ciência de dados e inteligência artificial para otimizar as decisões de preço e impulsionar a receita. O treinamento tem como base a expertise da Aprix em soluções para otimizar os resultados do pricing do início ao fim do processo.

Ao longo de quatro dias, o CEO da Aprix, Guilherme Zuanazzi, esteve na sede da Dexco para compartilhar conhecimento e auxiliar a empresa a alavancar seus resultados por meio do pricing. Foram 16 horas de curso, compartilhando casos reais de otimização de preços em diversos segmentos, abrangendo os seguintes tópicos:

→ Conceitos básicos de precificação
→ Estratégias de precificação
→ Elasticidade, Elasticidade Cruzada, Point-elasticity e Elasticidade Variável
→ Market-based pricing e Teoria dos Jogos
→ Ciência de dados e IA para modelagem de demanda em função de preços: Modelos Lineares e Modelos Não-Lineares
→ Atividade prática de programação

Agradecemos à equipe de precificação da Dexco pela confiança e pelas trocas enriquecedoras, em especial Giulia, Mariana, Cíntia, Bárbara, Gustavo, Priscila e Guilherme.

Se você também tem interesse em maximizar seus resultados a partir de estratégias de pricing baseadas em ciência de dados, entre em contato com nossa equipe através do link: https://bit.ly/curso-pricing

Ou simplesmente comente “quero saber mais” neste post e entraremos em contato com mais informações.

#pricing #rgm #treinamento",06/23/2023 06:06,https://www.instagram.com/p/Ct1bZm8OWWB/,Carrossel do Instagram,Vitalício,418,335,1,30,1,0,,
"Embora a otimização de atividades com inteligência artificial esteja cada vez mais presente em processos de todos os segmentos, uma perspectiva inovadora propõe iniciar a automação por um setor-chave para qualquer empresa: o pricing. Entre os fatores que justificam essa decisão, estão o aumento de receita e de resultados e boa aceitação das equipes.

Leia o texto no Aprix Journal: https://bit.ly/3ClKA2H, ou acesse o link na bio",06/27/2023 09:06,https://www.instagram.com/p/CuAExR6uJjY/,Imagem do Instagram,Vitalício,230,204,0,8,0,0,,
"Ao desenvolvermos soluções de IA, temos que estar atentos às implicações éticas geradas pelo uso da tecnologia.

Isso é importante porque, muitas vezes, o uso das ferramentas foge da intenção de quem as desenvolveu. Um exemplo disso é esse teste realizado com o GPT-3: em relação a perguntas e comandos relacionados à comunidade LGBTQ+ o modelo exibiu preconceitos e respostas discriminatórias.

O viés presente nos modelos de linguagem é um reflexo dos dados de treinamento fornecidos pelos usuários, que muitas vezes refletem preconceitos e estereótipos existentes na sociedade. Por outro lado, existem diversas técnicas de machine learning que podem ser utilizadas para mitigar esse risco. 

Você já tinha pensado sobre isso? Leia o artigo e nos conte o que achou.

Acesse: bit.ly/LGBTQ-bias-in-GPT-3, ou clique no link da bio.

#pride",06/28/2023 14:06,https://www.instagram.com/p/CuDKxUOOjBy/,Carrossel do Instagram,Vitalício,212,164,2,20,0,0,,
"O lançamento de um novo produto é um momento crítico para as empresas, e a definição do preço de lançamento desempenha um papel estratégico em seu sucesso. Para os executivos especialistas em pricing, encontrar a abordagem ideal que maximize os lucros e conquiste uma fatia significativa do mercado é essencial. Nesta matéria, mergulhamos nas estratégias avançadas de pricing que irão impulsionar os resultados do seu lançamento de produto, elevando sua vantagem competitiva.

Leia o texto no Aprix Journal: https://bit.ly/3NAit3Q, ou acesse o link na bio.",06/29/2023 11:06,https://www.instagram.com/p/CuFdAT0O-t5/,Imagem do Instagram,Vitalício,270,227,0,13,0,1,,
"Hoje é dia de conhecer quem entrou na equipe durante o 1º trimestre de 2023. 🚀

Aqui na Aprix, seguidamente temos vagas abertas com planos de carreira e trilhas de desenvolvimento. Mande seu currículo para careers@aprix.com.br e junte-se ao melhor time!

Confira as vagas abertas em bit.ly/vagasaprix, ou no link da bio.",04/04/2023 11:04,https://www.instagram.com/p/Cqn-PY7ucaH/,Carrossel do Instagram,Vitalício,836,530,2,79,2,1,,
"A Aprix esteve presente na segunda edição do South Summit Brazil, evento que reuniu mais de 900 palestrantes e 22 mil participantes em Porto Alegre. Além de participar da feira de negócios, o CEO da Aprix, Guilherme Zuanazzi, foi painelista em uma discussão sobre retenção de talentos, compartilhando experiências e estratégias de sucesso. 

O South Summit é um dos principais eventos de tecnologia e empreendedorismo do mundo e tem como objetivo promover a inovação em diferentes setores.

Saiba mais no Aprix Journal. Acesse: https://bit.ly/3KKqraN, ou o link na bio.",04/05/2023 10:04,https://www.instagram.com/p/CqqarZdOlPc/,Imagem do Instagram,Vitalício,238,209,1,37,0,0,,
